{
  "attribution_id": "bench-execution-attribution:sha256:39ccce8280d2b2144b2d40df7aebc2ea3f6cdee42aef8fd6efade0608b870556",
  "schema": "studio.bench.execution-attribution.v2",
  "completed_at": "2026-07-20T00:18:44.206Z",
  "attempt_id": "bench-attempt:sha256:187c153c1eeca962ba0310d870c631d16eda8f2105ccb3ae452270aa519bb9ee",
  "run": "rule-change-ko-kinship-address-context-provider-authorized-c3-r3-with",
  "side": "with",
  "release_id": "bench-certified-release:sha256:1bafaf5c9d5e03780c2ffe4e513aba80b06ce568385f613bbb7b606b332df71f",
  "host_context_id": "bench-host-context:sha256:0c0b4379a0a7869328f5dd73a2256e47d8d4563877922ae0ea33743d4c76eab3",
  "execution_input": {
    "path": "bench/attempts/rule-change-ko-kinship-address-context-provider-authorized-c3-r3-with/execution-input.json",
    "content_id": "sha256:ca47037d0b8b7f5b52ed00d142cb6df0ed37db95cd9634dea624e96418c7a65d",
    "bytes": 2251,
    "id": "bench-execution-input:sha256:c96132e8695fa9558678de1d3f8ffb829f140d8058ad66c4951a16c6fe1d1056"
  },
  "charge": {
    "path": "bench/attempts/rule-change-ko-kinship-address-context-provider-authorized-c3-r3-with/charge.json",
    "content_id": "sha256:91e389391e8675f79e18882e994938116e0c8e3b1c83a71d6032149cf481392c",
    "bytes": 866,
    "attempt_id": "bench-attempt:sha256:187c153c1eeca962ba0310d870c631d16eda8f2105ccb3ae452270aa519bb9ee"
  },
  "charge_journal": {
    "path": "bench/attempts/rule-change-ko-kinship-address-context-provider-authorized-c3-r3-with/journal.json",
    "content_id": "sha256:b7bb487d478bff2c9b5edf11b2d802e3944e60ea80603c4280e46f94759ad567",
    "bytes": 464,
    "head_commit": "45e2f6225336400c589507d9d9c91c1af3781d53",
    "charge_commit": "8ea13593d35630b57046fc103400dcbcd9567391"
  },
  "provider_call": {
    "path": "bench/attempts/rule-change-ko-kinship-address-context-provider-authorized-c3-r3-with/provider-call.json",
    "content_id": "sha256:01a5ab392b7d7410d342aef8c4fa6278767abd28d99159c21a449bbcd1af5833",
    "bytes": 1615,
    "id": "bench-provider-call:sha256:d14c0e5f86d5f9c7df71a95ec0818194f70e99e15dd6b9cf5c765edb3c3fa50c"
  },
  "capture": {
    "path": "bench/runs/rule-change-ko-kinship-address-context-provider-authorized-c3-r3-with/capture.json",
    "content_id": "sha256:9d9c75e7b5c13e1a47c0aa79d98954719ae689625108dc3019f66c24fc9c7d84",
    "bytes": 3123,
    "id": "rule-change-ko-kinship-address-context-provider-authorized-c3-r3-with"
  }
}
